{
  "$schema": "https://raw.githubusercontent.com/riteofstring/code-polishy/main/schema/code-polishy-language-conformance-ledger-v1.schema.json",
  "protocol": "language-conformance-ledger/v1",
  "taskBase": "ad60b7cfa0141e98dd2b72033db65cb73a5121d8",
  "lockedRelease": "0.27.8",
  "references": {
    "currentMain": {
      "revision": "ad60b7cfa0141e98dd2b72033db65cb73a5121d8",
      "version": "0.27.8"
    },
    "immutableOrigin": {
      "revision": "a800e66ef3ac5fc57c9d103dc84688aaa68ef4e8",
      "version": "0.25.0"
    },
    "optionalProvider": {
      "revision": "a800e66ef3ac5fc57c9d103dc84688aaa68ef4e8",
      "version": "0.25.0"
    }
  },
  "fixtures": [
    "fixtures/go-gofmt-diagnostic.json",
    "fixtures/go-discovery-quality.json",
    "fixtures/go-architecture.json",
    "fixtures/go-dependencies.json",
    "fixtures/go-toolchain.json",
    "fixtures/python-discovery-quality.json",
    "fixtures/python-architecture.json",
    "fixtures/python-reachability.json",
    "fixtures/python-dependencies.json",
    "fixtures/python-toolchain.json",
    "fixtures/javascript-discovery-quality.json",
    "fixtures/javascript-analysis.json",
    "fixtures/javascript-architecture.json",
    "fixtures/javascript-dependencies.json",
    "fixtures/javascript-toolchain.json",
    "fixtures/shell-complete.json",
    "fixtures/shared-scope-policy.json",
    "fixtures/shared-testing-dependencies.json",
    "fixtures/shared-lifecycle-adjacent.json",
    "fixtures/format-write.json"
  ],
  "behaviors": [
    {
      "id": "go.discovery.modules",
      "language": "go",
      "capability": "discovery",
      "guarantee": "Root and nested go.mod projects are found statically, malformed or ambiguous ownership fails visibly, and every governed Go source has one contained module.",
      "currentImplementation": [
        "internal/repository/go_modules.go",
        "internal/quality/quality.go"
      ],
      "helpers": ["internal/repository/repository_inventory.go"],
      "cliRoutes": ["check", "architecture", "supply-chain"],
      "policyKeys": [],
      "activation": ["A governed .go file or go.mod is present."],
      "documentation": [
        "docs/policies/code-quality.md",
        "docs/policies/supply-chain.md"
      ],
      "tests": [
        "internal/repository/go_modules_test.go#TestInspectGoModulesUsesOfficialModuleParser",
        "internal/quality/quality_test.go#TestCoverageRejectsAmbiguousCustomLanguageRules"
      ],
      "futureOwner": "pack",
      "boundaryRationale": "The Go pack interprets Go module structure; core validates contained paths and unique ownership.",
      "fixtures": ["go-discovery-quality"],
      "commands": ["check", "architecture", "supply-chain"],
      "profiles": ["check", "architecture", "offline"],
      "modes": ["full", "focused"],
      "platforms": [
        "darwin-amd64",
        "darwin-arm64",
        "linux-amd64",
        "linux-arm64",
        "windows-amd64"
      ],
      "status": "untested"
    },
    {
      "id": "go.discovery.workspaces",
      "language": "go",
      "capability": "discovery",
      "guarantee": "go.work use and replace declarations resolve only contained unique modules and do not add unlisted projects to focused analysis.",
      "currentImplementation": [
        "internal/repository/go_modules.go",
        "internal/architecture/go_graph_scope.go"
      ],
      "helpers": [],
      "cliRoutes": ["check", "architecture", "supply-chain"],
      "policyKeys": [],
      "activation": ["A go.work file is present."],
      "documentation": [
        "docs/policies/architecture.md",
        "docs/policies/supply-chain.md"
      ],
      "tests": [
        "internal/repository/go_modules_test.go#TestInspectGoModulesResolvesContainedWorkspaceUses",
        "internal/architecture/source_graph_scope_test.go#TestGoWorkspaceSelectionDoesNotIncludeUnlistedProjects"
      ],
      "futureOwner": "pack",
      "boundaryRationale": "The pack owns Go workspace semantics while core owns containment and selection authority.",
      "fixtures": ["go-discovery-quality"],
      "commands": ["check", "architecture", "supply-chain"],
      "profiles": ["check", "architecture", "offline"],
      "modes": ["full", "focused"],
      "platforms": [
        "darwin-amd64",
        "darwin-arm64",
        "linux-amd64",
        "linux-arm64",
        "windows-amd64"
      ],
      "status": "untested"
    },
    {
      "id": "go.discovery.packages-build-constraints",
      "language": "go",
      "capability": "discovery",
      "guarantee": "Packages, external test packages, build tags, generated paths, and platform-constrained files retain their real package and source identities.",
      "currentImplementation": [
        "internal/architecture/go_graph.go",
        "internal/architecture/go_graph_scope.go"
      ],
      "helpers": ["internal/repository/go_modules.go"],
      "cliRoutes": ["check", "architecture"],
      "policyKeys": ["scope.generated"],
      "activation": [
        "Governed Go source is selected or required as dependency context."
      ],
      "documentation": [
        "docs/policies/architecture.md",
        "docs/design/provider-scope.md"
      ],
      "tests": [
        "internal/architecture/source_graph_test.go#TestGoExternalTestPackageImportsDoNotCreateSelfCycles",
        "internal/architecture/architecture_test.go#TestGeneratedGoImportStillFollowsRepositoryGraph"
      ],
      "futureOwner": "pack",
      "boundaryRationale": "Go syntax and build selection belong to the pack; core retains generated classification and graph policy.",
      "fixtures": ["go-discovery-quality"],
      "commands": ["check", "architecture"],
      "profiles": ["check", "architecture"],
      "modes": ["full", "focused"],
      "platforms": [
        "darwin-amd64",
        "darwin-arm64",
        "linux-amd64",
        "linux-arm64",
        "windows-amd64"
      ],
      "status": "untested"
    },
    {
      "id": "go.quality.format-syntax",
      "language": "go",
      "capability": "format",
      "guarantee": "Pinned gofmt detects exact unformatted selected files, write mode edits only authorized files, and Go syntax failures remain precise and non-silent.",
      "currentImplementation": ["internal/quality/quality.go"],
      "helpers": ["internal/repository/contained_write.go"],
      "cliRoutes": ["check", "format"],
      "policyKeys": ["scope.generated", "scope.data"],
      "activation": ["Selected writable or check-only Go source exists."],
      "documentation": [
        "docs/policies/code-quality.md",
        "docs/design/provider-scope.md"
      ],
      "tests": [
        "internal/quality/quality_test.go#TestGoComplexityUsesProductionThreshold",
        "internal/engine/generated_format_test.go#TestFormatGitChangesDoesNotWriteAnalysisExpansion"
      ],
      "futureOwner": "pack",
      "boundaryRationale": "The Go pack owns parsing and formatting; core grants write authority and applies edits.",
      "fixtures": ["go-discovery-quality", "go-gofmt-diagnostic"],
      "commands": ["check", "format"],
      "profiles": ["check", "format"],
      "modes": ["check", "write"],
      "platforms": [
        "darwin-amd64",
        "darwin-arm64",
        "linux-amd64",
        "linux-arm64",
        "windows-amd64"
      ],
      "status": "untested"
    },
    {
      "id": "go.quality.vet-staticcheck",
      "language": "go",
      "capability": "lint",
      "guarantee": "go vet and pinned staticcheck run at the required package scope, preserve diagnostic identity and locations, and fail visibly when tools or coverage are unavailable.",
      "currentImplementation": ["internal/quality/quality.go"],
      "helpers": ["internal/runner/runner.go"],
      "cliRoutes": ["check"],
      "policyKeys": [],
      "activation": [
        "Governed Go source is selected for check or gate analysis."
      ],
      "documentation": ["docs/policies/code-quality.md"],
      "tests": [
        "internal/quality/quality_test.go#TestCoverageAdmitsManagedBuiltInCommands"
      ],
      "futureOwner": "pack",
      "boundaryRationale": "The pack owns Go analyzers and package scope; core owns execution bounds and finding policy.",
      "fixtures": ["go-discovery-quality"],
      "commands": ["check"],
      "profiles": ["check", "gate"],
      "modes": ["full", "focused"],
      "platforms": [
        "darwin-amd64",
        "darwin-arm64",
        "linux-amd64",
        "linux-arm64",
        "windows-amd64"
      ],
      "status": "untested"
    },
    {
      "id": "go.quality.complexity-comments",
      "language": "go",
      "capability": "source-facts",
      "guarantee": "Go function complexity uses separate production and test thresholds, comments retain exact grammar and directives, and generated exemptions do not weaken other analysis.",
      "currentImplementation": [
        "internal/quality/quality.go",
        "internal/quality/comments.go"
      ],
      "helpers": [],
      "cliRoutes": ["check"],
      "policyKeys": [
        "quality.complexity.go",
        "quality.complexity.goTest",
        "quality.allowComments"
      ],
      "activation": ["Governed Go source is selected."],
      "documentation": [
        "docs/policies/code-quality.md",
        "docs/design/source-comment-policy.md"
      ],
      "tests": [
        "internal/quality/quality_test.go#TestGoComplexityUsesProductionThreshold",
        "internal/quality/comments_test.go#TestGoDirectiveGrammarBoundaries"
      ],
      "futureOwner": "shared-protocol",
      "boundaryRationale": "The pack emits Go syntax facts; core applies locked complexity and comment policy.",
      "fixtures": ["go-discovery-quality"],
      "commands": ["check"],
      "profiles": ["check"],
      "modes": ["full", "focused"],
      "platforms": [
        "darwin-amd64",
        "darwin-arm64",
        "linux-amd64",
        "linux-arm64",
        "windows-amd64"
      ],